{
  "id": "rego_api_authz",
  "title": "Rego for API Authorization",
  "subtitle": "JWT claims, team scoping, tenant isolation",
  "level": "intermediate",
  "number": 7,
  "estimatedTime": 90,
  "difficulty": 3,
  "prerequisites": [
    "rego_foundations"
  ],
  "content": "\n            <div class=\"lesson-section\">\n                <h3>👥 Team-Scoped Access (Reviewed Pattern)</h3>\n                <p>The most-copied real-world Rego shape (Keycloak+OPA demo repos): members of a team get read+write on <em>only that team's</em> objects, derived from the URL, plus role-wide read and full-admin grants. Critically reviewed: the <code>concat([\"Team\", id])</code> derivation ties the URL to the group claim, closing IDOR by construction.</p>\n                \n            <div class=\"code-example\" style=\"margin: 1rem 0; border-left: 4px solid var(--ai-purple);\" data-code-id=\"pbac-cb-3\">\n                <div style=\"display: flex; justify-content: space-between; align-items: center; padding: 0.25rem 0.5rem; background: var(--surface-light); border-radius: 4px 4px 0 0;\">\n                    <span style=\"font-size: 0.8rem; color: var(--text-muted);\">Team scoping + role grants (Rego 1.x if-syntax)</span>\n                    <button class=\"btn-small\" onclick=\"pbacCopy('pbac-cb-3')\" aria-label=\"Copy code\" style=\"padding: 0.15rem 0.4rem; font-size: 0.75rem; background: var(--surface-color); color: var(--text-secondary); border: 1px solid var(--border-color); border-radius: 4px; cursor: pointer;\">📋 Copy</button>\n                </div>\n                <pre style=\"margin: 0; padding: 1rem; background: var(--code-bg); border-radius: 0 4px 4px 0; overflow-x: auto; font-size: 0.85rem;\" tabindex=\"0\" role=\"region\" aria-label=\"Code block\"><code class=\"language-rego\"># Last verified: 2026-09 vs mouton0815/authorization-with-OPA demo-rules.rego\npackage demo\n\ndefault allow := false\n\n# Members of a team have read+write on ONLY that team's data\nallow if {\n    input.method in {\"GET\", \"PUT\"}\n    teamId := trim_prefix(input.path, \"/teams/\")\n    teamName := concat(\"\", [\"Team\", teamId])\n    teamName in input.groups\n}\n\n# Users with \"api-read\" rights can read all endpoints\nallow if {\n    input.method == \"GET\"\n    \"api-read\" in input.roles\n}\n\n# Users with \"api-full\" rights have full access\nallow if {\n    \"api-full\" in input.roles\n}</code></pre>\n                <div id=\"pbac-cb-3\" class=\"code-source\" style=\"display:none;\"># Last verified: 2026-09 vs mouton0815/authorization-with-OPA demo-rules.rego\npackage demo\n\ndefault allow := false\n\n# Members of a team have read+write on ONLY that team's data\nallow if {\n    input.method in {\"GET\", \"PUT\"}\n    teamId := trim_prefix(input.path, \"/teams/\")\n    teamName := concat(\"\", [\"Team\", teamId])\n    teamName in input.groups\n}\n\n# Users with \"api-read\" rights can read all endpoints\nallow if {\n    input.method == \"GET\"\n    \"api-read\" in input.roles\n}\n\n# Users with \"api-full\" rights have full access\nallow if {\n    \"api-full\" in input.roles\n}</div>\n            </div>\n        \n            </div>\n\n            <div class=\"lesson-section\">\n                <h3>🏢 Tenant Isolation at the Gateway (Reviewed Pattern)</h3>\n                <p>The Envoy+OPA payments-gateway pattern separates duties: Envoy validates the JWT (issuer, audience, expiry) and forwards claims; OPA authorizes. Admins pass everywhere; analysts only <code>GET</code> inside their own tenant, compared case-insensitively against the request header.</p>\n                \n            <div class=\"code-example\" style=\"margin: 1rem 0; border-left: 4px solid var(--ai-purple);\" data-code-id=\"pbac-cb-4\">\n                <div style=\"display: flex; justify-content: space-between; align-items: center; padding: 0.25rem 0.5rem; background: var(--surface-light); border-radius: 4px 4px 0 0;\">\n                    <span style=\"font-size: 0.8rem; color: var(--text-muted);\">Tenant isolation: JWT claim vs request header</span>\n                    <button class=\"btn-small\" onclick=\"pbacCopy('pbac-cb-4')\" aria-label=\"Copy code\" style=\"padding: 0.15rem 0.4rem; font-size: 0.75rem; background: var(--surface-color); color: var(--text-secondary); border: 1px solid var(--border-color); border-radius: 4px; cursor: pointer;\">📋 Copy</button>\n                </div>\n                <pre style=\"margin: 0; padding: 1rem; background: var(--code-bg); border-radius: 0 4px 4px 0; overflow-x: auto; font-size: 0.85rem;\" tabindex=\"0\" role=\"region\" aria-label=\"Code block\"><code class=\"language-rego\"># Last verified: 2026-09 vs Envoy+OPA payments_authz (justinpolidori.com)\npackage envoy.authz\n\ndefault allow := false\n\n# Claims arrive via input.jwt_claims, populated by Envoy's jwt_authn\n# filter AFTER RS256/exp/aud verification. OPA never verifies\n# signatures itself — trusting unverified claims is a critical finding.\nverified_claims := input.jwt_claims\n\n# Admin: everything\nallow if {\n    verified_claims.role == \"admin\"\n}\n\n# Analyst: GET /payments/* only within own tenant\nallow if {\n    verified_claims.role == \"analyst\"\n    input.attributes.request.http.method == \"GET\"\n    input.parsed_path[0] == \"payments\"\n    lower(verified_claims.tenant) == lower(input.attributes.request.http.headers[\"x-tenant\"])\n}\n\n# Debug/audit helper: name the cause when nothing matches\ndeny_reason contains msg if {\n    not allow\n    not verified_claims.role\n    msg := \"denied: no verified JWT claims in input (authN did not run?)\"\n}</code></pre>\n                <div id=\"pbac-cb-4\" class=\"code-source\" style=\"display:none;\"># Last verified: 2026-09 vs Envoy+OPA payments_authz (justinpolidori.com)\npackage envoy.authz\n\ndefault allow := false\n\n# Claims arrive via input.jwt_claims, populated by Envoy's jwt_authn\n# filter AFTER RS256/exp/aud verification. OPA never verifies\n# signatures itself — trusting unverified claims is a critical finding.\nverified_claims := input.jwt_claims\n\n# Admin: everything\nallow if {\n    verified_claims.role == \"admin\"\n}\n\n# Analyst: GET /payments/* only within own tenant\nallow if {\n    verified_claims.role == \"analyst\"\n    input.attributes.request.http.method == \"GET\"\n    input.parsed_path[0] == \"payments\"\n    lower(verified_claims.tenant) == lower(input.attributes.request.http.headers[\"x-tenant\"])\n}\n\n# Debug/audit helper: name the cause when nothing matches\ndeny_reason contains msg if {\n    not allow\n    not verified_claims.role\n    msg := \"denied: no verified JWT claims in input (authN did not run?)\"\n}</div>\n            </div>\n        \n            </div>\n\n            <div class=\"lesson-section\">\n                <h3>🔍 Critical Review Notes (Do Not Skip)</h3>\n                <ul>\n                    <li><strong>OPA does not verify JWT signatures by itself</strong> — the Hoop.dev JWT+OPA guide and the Envoy pattern agree: fetch JWKS, pin RS256 (never <code>none</code>), check <code>exp/nbf</code> <em>before</em> claims are trusted. Our gateway example delegates this to Envoy.</li>\n                    <li><strong><code>failure_mode_allow: false</code></strong> on the ext_authz filter: if OPA is down or slow (&gt;200ms), deny. The reviewed config sets this explicitly.</li>\n                    <li><strong>Every reviewed repo pins the cross-tenant deny-test</strong> (<code>test_analyst_denied_other_tenant</code>). Copy that test into your suite verbatim, adapted to your paths.</li>\n                </ul>\n            </div>\n\n            <div class=\"lesson-section\">\n                <h3>📨 The Input Contract (Keycloak-middleware shape)</h3>\n                \n            <div class=\"code-example\" style=\"margin: 1rem 0; border-left: 4px solid var(--ai-purple);\" data-code-id=\"pbac-cb-5\">\n                <div style=\"display: flex; justify-content: space-between; align-items: center; padding: 0.25rem 0.5rem; background: var(--surface-light); border-radius: 4px 4px 0 0;\">\n                    <span style=\"font-size: 0.8rem; color: var(--text-muted);\">Canonical authZ input: user, action (resource:verb), resource</span>\n                    <button class=\"btn-small\" onclick=\"pbacCopy('pbac-cb-5')\" aria-label=\"Copy code\" style=\"padding: 0.15rem 0.4rem; font-size: 0.75rem; background: var(--surface-color); color: var(--text-secondary); border: 1px solid var(--border-color); border-radius: 4px; cursor: pointer;\">📋 Copy</button>\n                </div>\n                <pre style=\"margin: 0; padding: 1rem; background: var(--code-bg); border-radius: 0 4px 4px 0; overflow-x: auto; font-size: 0.85rem;\" tabindex=\"0\" role=\"region\" aria-label=\"Code block\"><code class=\"language-json\">{ \"input\": {\n    \"user\": { \"user_id\": \"u-2\", \"roles\": [\"analyst\"],\n              \"tenant_id\": \"t1\", \"auth_source\": \"keycloak\" },\n    \"action\": \"payments:read\",\n    \"resource\": { \"type\": \"payment\", \"id\": \"123\", \"tenant_id\": \"t1\" } } }</code></pre>\n                <div id=\"pbac-cb-5\" class=\"code-source\" style=\"display:none;\">{ \"input\": {\n    \"user\": { \"user_id\": \"u-2\", \"roles\": [\"analyst\"],\n              \"tenant_id\": \"t1\", \"auth_source\": \"keycloak\" },\n    \"action\": \"payments:read\",\n    \"resource\": { \"type\": \"payment\", \"id\": \"123\", \"tenant_id\": \"t1\" } } }</div>\n            </div>\n        \n            </div>\n            \n            <div class=\"lesson-section\" style=\"background: rgba(139, 92, 246, 0.08); border-left: 4px solid var(--ai-purple); padding: 0.75rem 1rem; border-radius: 4px;\">\n                <strong>🎮 Try it in the Policy Lab →</strong> Run the analyst/admin scenarios and watch tenant mismatch deny. Use the controls under the canvas to switch scenarios and watch the verdict change.\n            </div>\n        \n        ",
  "concepts": [